date,text,website,hotel
2017-08-03, If I had to improve something it would be that hot breakfast should be included in the breakfast price and not cost extra We did not opt in for breakfast for this reason   Best hotel I ve stayed in in the UK I particularly loved the staff their willingness to help you even at silly o clock in the morning ,Booking.com,Belgrave
2017-08-02, Rooms could have been bigger for an exec room  We liked that it was close to the tube and that the hotel was welcoming We enjoyed the continental breakfast but felt that the cooked breakfast could have been included in the rate rather than extra this always seem to say if in London you get charged more making the short break say more bout monies spent rather than the whole London experience ,Booking.com,Belgrave
2017-08-02, Windows were thin so when your room is at the driveways side you pretty much hear everything Room didn t have refrigerator   Breakfast was excellent and rooms were better than we thought they would be Really close to Victorias station and Pimlico line Good soundproof between the rooms ,Booking.com,Belgrave
2017-08-02, The roof leaked from the air conditioning all night in the room Highly annoying drip keeping us awake most of the night   Nice looking hotel with friendly staff Just didn t get the best nights sleep due to a leak in the room ,Booking.com,Belgrave
2017-07-30, Staff was OK but would not say excellent Breakfast if you choose to eat there was very good but pricey You can eat out for less and get same meal   Location was great for us A small walk to underground Would stay again This area has LOTS of similar hotels to choose from ,Booking.com,Belgrave
2017-07-27,  Great central location walking distance to Victoria or Pimlico Hotel fresh and clean lovely continental breakfast Will return if the price is right ,Booking.com,Belgrave
2017-07-18,  The staff here are so lovely Always smiling Great location as quite near popular tourist places in London Breakfast was always delicious too Thank you for a wonderful stay ,Booking.com,Belgrave
2017-07-18,  Lovely hotel All mod cons were provided in the room Room was not the biggest I have stayed in but was fine for a weekend stay Free parking outside at the weekend which for London could easily have saved you 40 Would definitely stay here again as staff were friendly and accomadating ,Booking.com,Belgrave
2017-07-18, Nothing   The breakfast was excellent Everything was so fresh and the coffee options were excellent The staff helped us order a taxi It was a wonderful one night stay ,Booking.com,Belgrave
2017-07-17, The mattress should have been retired a long time ago very uncomfortable and you stay a hotel to get a good night s rest Bar in lobby not invited no food except breakfast buffett   Good feeling to property neighborhood room size,Booking.com,Belgrave
2017-07-16, Only breakfast available would have been good be able to get some snacks light meals during the rest of the day   Staff were so friendly and helpful,Booking.com,Belgrave
2017-07-11,  Amazing rooms Great customer service In the room there was also available a phone that could be used around to make calls and surf the internet without limits or restrictions that s an unique service never saw any other hotel taking so much care of their guests ,Booking.com,Belgrave
2017-07-11,  Room was clean although a little small Nice breakfast although a bit rushed arrived at 9 05am to be advised that we needed to get what you want quickly as the buffet will be cleared away at 9 30am And it was promptly ,Booking.com,Belgrave
2017-07-10, we didn t book a longer stay   Wonderful hotel wonderful staff wonderful room wonderful stay Absolutely perfect and will definitely be staying again on another visit to London Thank you The Belgrave ,Booking.com,Belgrave
2017-07-10, Found the room very small for 2 people It had everything we needed but the bed was a small double and it just seemed a little cramped   The location of the hotel for us was excellent Hotel was very clean and the staff were very informative and very friendly ,Booking.com,Belgrave
2017-07-09,  Tiny room but I understand cuz it was in London There were not a lot of food at the breakfast but overall it was alright The room was clean and the staff was nice ,Booking.com,Belgrave
2017-07-08, Shower was a bit lukewarm but as it was a roasting hot day we weren t too fussed by this  Compact and bijou Lovey and clean nicely decorated and great location Staff were friendly and very helpful Would definitely recommend ,Booking.com,Belgrave
2017-07-05,  Loved our stay here The room was small but I expect this from a city centre hotel it was clean quiet and comfy Staff were excellent and breakfast which was included was good Fab location and I would definitely stay here again,Booking.com,Belgrave
2017-07-03, I asked for a wake up call at 7am and it didn t happen Fortunately I woke up at 7 20 and managed to get to the business appointment on time   Nice decoration room very clean and a very comfortable bed ,Booking.com,Belgrave
2017-07-02, We booked the executive double Nice view but don t be expecting them to be spacious Also we had to request fresh towels and the room to be cleaned This wouldn t of happened if we hadn t of asked This stay was for 2 nights   Great location nice places to eat around the hotel short walk from the tube station Decent 20mins walk to Buckingham palace Nice view from the top floor bedrooms ,Booking.com,Belgrave
2017-07-02,  Second time staying here and again was not disappointed From check in to check out the staff were so friendly and welcoming Rooms regularly cleaned and the hotel is ideally located near both Pimlico and Victoria stations Will be back again for sure ,Booking.com,Belgrave
2017-07-01, no eggs included in the buffet to be ordered la carte cleanliness so and so  breakfast location smartphone with unlimited data and phone calls ,Booking.com,Belgrave
2017-06-26,  The air con was fantastic as it was 30 degrees outside The room was lovely and the bed was really comfy walking distance to Victoria station and Pimlico tube and bus stop along from hotel so very easy to get about Staff were friendly and helpful and available 24hrs,Booking.com,Belgrave
2017-06-26, Tiny closet  Room was a good size by London standard Location is great air conditioned rooms lift great coffee machine small fridge a lot of outlets The mobile phone to use during the state with unlimited service is a very useful thing to have ,Booking.com,Belgrave
2017-06-25, The room was small and did not have a luggage rack so we had a hard time with the suitcases The staff could not answer any questions about the tube etc and they were argumentative with each other and us We wanted to order a taxi and the man wanted to order a town car for a 10 minute ride We will not stay at this hotel again   We could walk to Pimlico station The tv had several English channels ,Booking.com,Belgrave
2017-06-23, We had a compact room which was as it said but had everything in it and spotlessly clean   Beautiful hotel in a lovely location staff were so nice and friendly and a wonderful breakfast in the morning very impressed with everything,Booking.com,Belgrave
2017-06-23,  Lovely property fitted out to a high standard We were attending Chelsea Flower Show and booked this hotel mainly because it was only a 15 minute walk to the show but we really enjoyed our stay at the Belgrave ,Booking.com,Belgrave
2017-06-20, My room was rather small   The breakfast was excellent The decor and fittings all modern A good location between two different stations depending on where you want to travel Bus close by too In walking distance to Knightsbridge area and Harrods ,Booking.com,Belgrave
2017-06-16,  Very clean modern comfortable size rooms Very quiet and beds comfortable The reception staff were very friendly and welcoming the breakfast room staff also friendly and always kept tables cleared and food topped up very good breakfast selection Location excellent close to Victoria and Pimlico stations nice selection of local restaurants serving good quality food at mostly reasonable prices Also close to a lot of major sites of interest The area felt very safe and good mix of small hotels and solid residential apartments Highly recommend,Booking.com,Belgrave
2017-06-14,  Sara and Sarah on reception went above and beyond the call of duty to trace my husbands camera which he had left in a black cab The taxi driver who unfortunately didn t leave his name returned the camera later that evening and on our return it was In our room with a lovely note from Sara and Sarah ,Booking.com,Belgrave
2017-06-11, We had a difficult time finding the hotel on the first day We walked from Pimlico station and we were looking for the hotel sign but completely missed it because the sign was so small and indiscreet printed on a post outside of the front entrance   We enjoyed our one week stay at the hotel The staff were extremely friendly and helpful It was just a short walk to get to either the Pimlico or Victoria Tube stations Our room was very clean and comfortable nicely updated and modern We appreciated that the hotel provided us with a complimentary smart phone that was preloaded with maps and city guides very handy for first time visitors There was a nice selection of items for breakfast and the service and setting were excellent ,Booking.com,Belgrave
2017-06-09, Can t think of anything I had a problem with  Very nice hotel Room small but it was all that was needed and not smaller than other hotels I ve stayed in when in central London Brilliant shower although make sure you let the water in both the normal shower and the Cascade warm up before you switch from one to the other or you could get a shock Comfortable bed quiet room friendly staff and good continental breakfast with plenty of staff around to help My partner s brother and his partner live in Sweden and mentioned they plan to use this hotel for their base in the future when in London ,Booking.com,Belgrave
2017-06-03, Nothing  Great hotel 2 nights Walking 10 minutes to Victoria s station 20 minutes to Buckingham Palace Staff very helpful Breakfast brilliant Hotel surrounded by great restaurants pubs and coffee shops Rooms small but very clean and all the facilities Book this hotel with confidence you won t regret it ,Booking.com,Belgrave
2017-05-31, Couldn t get aircon to work but as middle of night didn t report it It was unfortunately very humid but room was fine after thunderstorm   Fabulous location close to Victoria but quiet excellent room facilities exceptionally clean newly refurbished great extras in the room delicious breakfast and friendly staff Nice restaurants close by ,Booking.com,Belgrave
2017-05-30, Room was extremely small   Close to Victoria Station Friendly staff Fabulous Italian restaurant just down the street Try O Solo Mio when in Belgravia area of London ,Booking.com,Belgrave
2017-05-30, Room was a bit small but that s what you get in London Shower head was leaking and spraying all over the side of the shower door  Very new and clean Good location ,Booking.com,Belgrave
2017-05-28, Nothing  The staff were so friendly and helpful The bed was also very comfortable The phone was also very handy The central location made it easy to walk to many of the sites of london,Booking.com,Belgrave
2017-05-25, Lovely hotel but very noisy room in the basement so got little sleep Raised the problem with front desk but nothing done or offered to resolve this very poor service  clean hotel,Booking.com,Belgrave
2017-05-23, Really couldn t fault the hotel and facilities maybe only the cost of a cup of tea in the lounge but that is all  Bed was superb Staff couldn t have been more helpful Breakfast was perfect Loved the extra mobile phone in the room and nespresso coffee machine,Booking.com,Belgrave
2017-05-23, The door could not be locked from inside they fixed it after reminding them lots of times there was no hot water for one day we could hear the people walking above us because of the thin roof same breakfast everyday we stayed 6 days and paid 1 300 pounds to have all the above issues The person anchorage did not bother to even appologize instead telling the staff what to tell us  ,Booking.com,Belgrave
2017-05-13, Slightly bigger room would have been nice but no big deal I stayed in an executive double with a colleague We worked in the lounge so the work desk while nice sized took up breathing space in the room   Much more of an intimate boutique hotel than is suggested by the picture The room we had was smallish for 2 people but not by European standards The bed was comfortable the staff was very accommodating and the continental breakfast was fantastic cold meats cheeses yoghurt fruit croissants and on and on Really nice bathroom with rainfall shower and yummy toiletries The lounge has a couple different seating areas and the bar was always open The location is excellent just a stone s throw from Pimlico underground ,Booking.com,Belgrave
2017-05-12, small rooms no hot water for first 24 hours due to broken boiler good area for Apollo Victoria theatre  comfy bed nice decor in reception and breakfast areas lovely coffee,Booking.com,Belgrave
2017-05-11, The room was too small for 2 people we didn t even have place to put our suitcases The bed was terrible the hotel can invest in some new mattresses We were very disappointed we paid a lot for nothing We should rather have stayed at a chain hotel   The breakfast was good The location of the hotel is good near to the Victoria station where we left our rental car ,Booking.com,Belgrave
2017-05-08, I would have liked to have had a bath in our executive room but that didn t detract from the overall fabulous stay For non business travellers it would have been nicer for guests to have a later breakfast time   Super comfy bed lovely spacious room Perfect for an overnight stay as a couple for a special occasion Shower was great as was breakfast Would definitely recommend as the location was only 5 minutes walk from Pimlico and the staff were really helpful and friendly ,Booking.com,Belgrave
2017-05-04, There was some noise from the room above which woke me up at 2am I guess this was because there is no sound proofing or people coming in at 2am don t tend to be aware of the noise they make  The service was good and the room was fine if a little small even though I knew it was a single room The location was excellent for me ,Booking.com,Belgrave
2017-04-30, Noisy i e people from above can be heard walking across the floor from our room woken up from music being played from the restaurant before breakfast was served   Modern comfortable bed and clean Shower is great ,Booking.com,Belgrave
2017-04-30, Noise from above We were in 401 and there was noise all night sounded like someone was constantly walking up and down on creeky boards which was hard to sleep 2nd night   Breakfast was lovely All fresh Nice touches to room with toiletries slippers etc,Booking.com,Belgrave
2017-04-28, Small bar with limited beer options   The room was bigger than I expected I was in a room at ground level and right at the foot path outside and the busy road but the sound insulation was great Really friendly and helpful staff Good location with public transport available and pubs all around if you look ,Booking.com,Belgrave
2017-04-28,  We were very happy with the staff Manos in particular could not have been any more accommodating Loved the free phone to take around the city that the hotel offers The breakfast included everything and was never out of anything Close to underground transportation which makes the location very good ,Booking.com,Belgrave
2017-04-27, Could not sleep well The aircon in the room does not work and has to be controlled form the reception The amount of noise made early in the morning made it impossible for me to sleep   The location was brilliant Facilities offered were good ,Booking.com,Belgrave
2017-04-25, Couldn t fill kettle from bathroom tap due to design of mixer tap and restricted sink space Could not fit one of my chargers in mains socket due to overhanging shelf   Fresh new clean environment Great location Wifi access Restaurant Bar ,Booking.com,Belgrave
2017-04-25, Size of the room My partner had just finished the London Marathon and struggled to navigate round the bed due to lack of space   Clean and comfortable room very quiet ,Booking.com,Belgrave
2017-04-24, Only stayed for 1 night wish it had been more   Room was clean warm and comfortable staff were friendly polite and professional Breakfast was excellent plenty of choice well cooked and presentable Everything was accessible from hotel ,Booking.com,Belgrave
2017-04-18, It ll be good if they installed some clothes hooks on the wall Not much space to hang coats etc   Nice modern rooms Loved the nespresso coffee slippers toiletries etc Very well thought Was really impressed with the free use of Handy a device for us to surf net etc and the night snack delivery service We arrived at 10pm and was so hungry and tired So it s really a nice touch Great location Bus stop for 24 is just nearby You can walk to Pimlico or Victoria station Or walk to Buckingham palace Westminster etc ,Booking.com,Belgrave
2017-04-18, We were in a basement room so the view was nt great Like all London hotels the rooms are small The disadvantages were well out weighed by the advantages  All the members of staff we encountered were bright welcoming and helpful most impressive It s a peaceful location very near to the bustle of Victoria station The breakfast was good the full English perfectly cooked to order ,Booking.com,Belgrave
2017-04-17, The only complaint was that you had to pay an extra 4 each per day for a full breakfast  The staff was all really helpful and friendly the rooms are clean and the bed was really comfy,Booking.com,Belgrave
2017-03-31, Unpolite staff in the breakfast room Nice looking bathroom but no place to hang clothes no space by the sink The floor uneven in the room We heard every step from the guest above us starting very early in the morning  Nice balcony good location,Booking.com,Belgrave
2017-03-28, Warmer room on arriving   Staff were fantastic extremely knowledgable about london transport theatres attractions and nothing was too much trouble Breakfast first class and cleanliness of rooms and all areas pristine,Booking.com,Belgrave
2017-03-17,  The staff were very friendly Anybody booking a hotel room in central London should manage their expectations of the size of room they are going to get The room here was Bijou but was adequate for my purposes Room was saved by having rainfall shower rather than a bath and by having a queen bed rather than a full size double but since I was travelling alone this was fine The hotel is within walking distance of Pimlico tube and in a very nice area of London,Booking.com,Belgrave
2017-03-14, Couldn t fill kettle under tap Bed was a little soft   Room was described as compact and was exactly that But enough room for bed bathroom and hospitality tray and TV Liked decaf coffee being present without having to ask for it Check in was very friendly Included Continental breakfast was perfectly adequate ,Booking.com,Belgrave
2017-03-08, My room on the ground floor at the back 03 seemed to be a little cold for sitting in the room even though I played with the wall heat controller However the room temperature was fine for sleeping   Location is great for walking to Victoria Rail Station to get the Gatwick Express ,Booking.com,Belgrave
2017-03-08, Our Double room was extremely clean and modern but too small for 2 adults for 2 nights No wardrobe or anywhere to put luggage which was a shame but would still reccomend  Very clean hotel close to the amenities we wanted,Booking.com,Belgrave
2017-03-06, Very small room looking out on a brick wall Asked for a top floor room was given first floor People in room above stomping around at 6am for hours No soundproofing No storage space for clothes We have visited on previous occasions but this time not so good   Location,Booking.com,Belgrave
2017-03-06, Going home   The stay was fantastic from start to finish We couldn t fault the service facilities The staff were very friendly and professional The room was superb as was breakfast ,Booking.com,Belgrave
2017-03-05, The size of the room we had an executive double it was very small   The breakfast was lovely lots of choice and well presented All staff were very helpful and welcoming The decor and attention to detail in all areas of the hotel including the room was excellent ,Booking.com,Belgrave
2017-03-04, It s an older buildung that was recently renovated but the rooms are badly isolated It could be less comfortable if you have loud neighbours   Good located nice hotel for younger people The staff was friendly and we could go to our room earlier than stated without extra charge A great benefit was the phone we received for usage on the go with internet very handy if you quickly need to check a location on google maps ,Booking.com,Belgrave
2017-03-03, The sink location underneath a shelf in the bathroom meant I was unable to wash my face without having my head on the shelf Not enough space to store my wash things in the bathroom Lots of lights in the room however no main light left the room very dim Only mirror in the room on the wardrobe   The bed was comfortable Friendly staff ,Booking.com,Belgrave
2017-03-02, Only issue was on last night when the occupants of room above were moving about a lot in the night and disturbed my wife s sleep Suspect it was noisy due to laminate floors and lack of noise insulation below the top surface or ceiling of room to dampen the sound Not entirely hotel fault as cannot control guests nocturnal movements and they were not being loud and rowdy in any way but perhaps had a middle of the night start Consider we were unlucky to have those guests above us for that night and it would not put us off returning another time  Breakfast was excellent quality and replenished by staff who were both efficient and courteous Whole hotel was clean and welcoming with very friendly staff Good pleasant location away from noise and disturbance of the city but within close walking distance to most of what you want to see as a tourist in London ,Booking.com,Belgrave
2017-02-27, No negatives If they had an evening restaurant may be good   Every where was so clean Decor exellent Shower rooms small but very adaquate Staff lovley Pimlico is a great area to stay Easy walk to Victoria and Pimlico underground Will be the place I stay when visiting London ,Booking.com,Belgrave
2017-02-25, Below average breakfast definitely not at a 4 star hotel level Asked to pay at check in pretty unusual for a 4 star hotel reception staff not very attentive and customer oriented Hard to identify the location in absence of a visible logo except a very discrete one on the column next to the entrance no ashtray in front no trash can in the lobby   Clean good room facilities comfortable bed Excellent coffee maker cell phone companion with free wifi and calls ,Booking.com,Belgrave
2017-02-24, Limited clothes storage in the room but it was fine for a 1 or 2 night stay Everything else was good   Handy for underground and major tourist attractions Good continental breakfast included Super efficient check in and when we checked out they stored our luggage until later in the afternoon ,Booking.com,Belgrave
2017-02-23, I don t think it could have been better  First time at a London hotel where I haven t looked forward to my own bed Bed was excellent Also to be given a smartphone for the duration with free calls and 4G was wonderful ,Booking.com,Belgrave
2017-02-23,  Quiet room friendly staff excellent breakfast facilities my room on the fifth floor had a wide view of the London rooftops with Battersea Power station in the background ,Booking.com,Belgrave
2017-02-13, The bathroom was far to small  The bed was really comfy the room clean and nice The bathroom was far to small it was difficult to dry yourself after the shower due to no room ,Booking.com,Belgrave
2017-02-12, No coat hooks in room Could have had boiled eggs available at breakfast  Nice comfortable modern room Excellent shower Nice quiet Nice location Good breakfast,Booking.com,Belgrave
2017-02-11, The room could have been a bit bigger and the bathroom too we felt like we were falling over one another at times Explanation on how to use the information panel on the outside of the room to let staff know you didn t want to be disturbed bit awkward when we were getting ready to go out   Very comfortable bed and big too Good that you can actually open the window in the room too The shower was really nice and big just what you needed Good beverage prices especially for London ,Booking.com,Belgrave
2017-02-10, No instructions for the air conditioning room cold but sorted  Very comfortable great location within walking distance of Victoria station about 8 minutes Plenty of restaurants around Staff very friendly and helpful Very clean,Booking.com,Belgrave
2017-02-08,  The hotel was far better than expected considering the price I paid for London area It is central not far from museum s In the evening when to an excellent little bistro about 2 hundreds yards across the road ,Booking.com,Belgrave
2017-02-07, Nets on bathroom window not just blinds And the bedroom window doors were faulty very difficult to close once opened   Room cleaned daily and drinking facilities replenished daily Very good that we were able to leave our bags behind reception before check in ,Booking.com,Belgrave
2017-02-06, The noise of the floor above us when someone was walking was quite annoying and disrupted our sleep i think it was a cleaners room above us there were a lot of footsteps from 7 onwards in the morning   Staff were friendly the beds were comfy location was good and breakfast was good ,Booking.com,Belgrave
